{
  "project_id": "intl-comm-fl-eg02",
  "intent_version": "1.0.0",
  "source_summary": {
    "type": "mixed",
    "kva": 1600,
    "voltage_v": 400,
    "x_over_r": 7
  },
  "fault_currents": [
    {
      "node_id": "HV-1",
      "node_kind": "hv_source",
      "ifault_ka_max": 17.6,
      "ifault_ka_min": 16.0,
      "ipk_ka": 39.0,
      "x_over_r_ratio": 5,
      "z_total_ohm": 0.436
    },
    {
      "node_id": "TX-1",
      "node_kind": "transformer_secondary",
      "ifault_ka_max": 22.5,
      "ifault_ka_min": 20.4,
      "ipk_ka": 48.8,
      "x_over_r_ratio": 7,
      "z_total_ohm": 0.005
    },
    {
      "node_id": "MSB-1",
      "node_kind": "board_incoming",
      "ifault_ka_max": 21.5,
      "ifault_ka_min": 19.5,
      "ipk_ka": 46.5,
      "x_over_r_ratio": 6,
      "z_total_ohm": 0.007
    },
    {
      "node_id": "MSB-1.BUSBAR",
      "node_kind": "board_busbar",
      "ifault_ka_max": 21.4,
      "ifault_ka_min": 19.4,
      "ipk_ka": 46.3,
      "x_over_r_ratio": 6,
      "z_total_ohm": 0.007
    },
    {
      "node_id": "DB-L1",
      "node_kind": "board_incoming",
      "ifault_ka_max": 18.2,
      "ifault_ka_min": 16.5,
      "ipk_ka": 35.4,
      "x_over_r_ratio": 4,
      "z_total_ohm": 0.012
    }
  ]
}
