{
  "project_id": "uk-dom-fl-eg01",
  "intent_version": "1.0.0",
  "source_summary": {
    "type": "utility_transformer",
    "kva": 500,
    "voltage_v": 230,
    "x_over_r": 5
  },
  "fault_currents": [
    {
      "node_id": "TX-1",
      "node_kind": "transformer_secondary",
      "ifault_ka_max": 1.575,
      "ifault_ka_min": 1.425,
      "ipk_ka": 2.40,
      "x_over_r_ratio": 5,
      "z_total_ohm": 0.0042
    },
    {
      "node_id": "CU-G",
      "node_kind": "board_incoming",
      "ifault_ka_max": 1.50,
      "ifault_ka_min": 1.36,
      "ipk_ka": 2.30,
      "x_over_r_ratio": 2.5,
      "z_total_ohm": 0.008
    },
    {
      "node_id": "CU-G.BUSBAR",
      "node_kind": "board_busbar",
      "ifault_ka_max": 1.49,
      "ifault_ka_min": 1.35,
      "ipk_ka": 2.28,
      "x_over_r_ratio": 2.5,
      "z_total_ohm": 0.0081
    },
    {
      "node_id": "CU-G.C01",
      "node_kind": "final_circuit_endpoint",
      "ifault_ka_max": 0.85,
      "ifault_ka_min": 0.77,
      "ipk_ka": 1.22,
      "x_over_r_ratio": 0.5,
      "z_total_ohm": 0.228
    },
    {
      "node_id": "CU-G.C03",
      "node_kind": "final_circuit_endpoint",
      "ifault_ka_max": 0.79,
      "ifault_ka_min": 0.71,
      "ipk_ka": 1.14,
      "x_over_r_ratio": 0.4,
      "z_total_ohm": 0.289
    }
  ]
}
